{
	"name": "baz",
	"type": "http",
	"config": {
		"rateLimit": 100,
		"endpoints": [
			"call.json",
			"compare.json",
			"ping.json",
			"silly_noop.json",
			"trans.json",
			"trans-headers.json",
			"trans-headers-type.json",
			"trans-headers-no-req.json",
			"header-schema.json",
			"get-profile.json"
		]
	},
	"dependencies": {
		"client": [
			"baz"
		]
	}
}
