{
	"name": "bar",
	"type": "http",
	"config": {
		"rateLimit": 100,
		"endpoints": [
			"arg_not_struct.json",
			"arg_with_headers.json",
			"arg_with_query_params.json",
			"arg_with_nested_query_params.json",
			"arg_with_query_header.json",
			"arg_with_params.json",
			"arg_with_many_query_params.json",
			"missing_arg.json",
			"no_request.json",
			"normal.json",
			"too_many_args.json"
		]
	},
	"dependencies": {
		"client": [
			"bar"
		]
	}
}
